{
  "schema_version": "1.0",
  "skill_version": "1.0.0",
  "report_state": "draft",
  "mode": "read-only",
  "audit_id": "UNSET",
  "target": {
    "device_alias": null,
    "profile_alias": null,
    "execution_relationship": "unverified",
    "binding_evidence_ids": []
  },
  "baseline": {
    "purpose": null,
    "time_policy": null,
    "network_policy": null,
    "persistence_policy": null,
    "required_functions": []
  },
  "authorization": {
    "read_scope": null,
    "external_tests": null,
    "lifecycle_actions": null,
    "remediation": null,
    "artifact_location": null
  },
  "observation_window": {
    "started_at": null,
    "ended_at": null,
    "clock_accuracy_verified": false
  },
  "overall_result": "incomplete",
  "summary": "Unexecuted template. No local environment has been inspected.",
  "controls": {
    "CTX-01": {
      "domain": "Target and authority",
      "outcome": "NOT_TESTED",
      "expected": "The target relationship is supported by specific evidence; aliases alone are insufficient.",
      "observed": null,
      "evidence_ids": [],
      "rationale": "Unexecuted template.",
      "severity": null,
      "confidence": null,
      "next_action": "Bind the executing tool to the requested host, guest, container or remote runtime."
    },
    "CTX-02": {
      "domain": "Target and authority",
      "outcome": "NOT_TESTED",
      "expected": "Saved and live observations refer to the same identified profile.",
      "observed": null,
      "evidence_ids": [],
      "rationale": "Unexecuted template.",
      "severity": null,
      "confidence": null,
      "next_action": "Match browser, profile ID and live context."
    },
    "CTX-03": {
      "domain": "Target and authority",
      "outcome": "NOT_TESTED",
      "expected": "Requirements are established; unresolved preferences remain unknown.",
      "observed": null,
      "evidence_ids": [],
      "rationale": "Unexecuted template.",
      "severity": null,
      "confidence": null,
      "next_action": "Record purpose and intended time, route, persistence and function policies."
    },
    "CTX-04": {
      "domain": "Target and authority",
      "outcome": "NOT_TESTED",
      "expected": "Each performed action is within scope; unavailable permissions are explicit.",
      "observed": null,
      "evidence_ids": [],
      "rationale": "Unexecuted template.",
      "severity": null,
      "confidence": null,
      "next_action": "Record available access and action-specific authorization."
    },
    "HST-01": {
      "domain": "Host and software",
      "outcome": "NOT_TESTED",
      "expected": "Readings identify the executing environment without falsely identifying the physical device.",
      "observed": null,
      "evidence_ids": [],
      "rationale": "Unexecuted template.",
      "severity": null,
      "confidence": null,
      "next_action": "Read OS family, release and architecture using bounded local inspection."
    },
    "HST-02": {
      "domain": "Host and software",
      "outcome": "NOT_TESTED",
      "expected": "Versions describe the active installation and selected profile, not just the UA string.",
      "observed": null,
      "evidence_ids": [],
      "rationale": "Unexecuted template.",
      "severity": null,
      "confidence": null,
      "next_action": "Record full browser, profile-manager, kernel and relevant patch builds."
    },
    "HST-03": {
      "domain": "Host and software",
      "outcome": "NOT_TESTED",
      "expected": "Support and update conclusions are supported by current official documentation.",
      "observed": null,
      "evidence_ids": [],
      "rationale": "Unexecuted template.",
      "severity": null,
      "confidence": null,
      "next_action": "Compare active builds with the applicable current vendor support channel."
    },
    "HST-04": {
      "domain": "Host and software",
      "outcome": "NOT_TESTED",
      "expected": "The source and applicable controls are known and align with the approved policy.",
      "observed": null,
      "evidence_ids": [],
      "rationale": "Unexecuted template.",
      "severity": null,
      "confidence": null,
      "next_action": "Review install provenance and managed/security settings relevant to the browser."
    },
    "TIM-01": {
      "domain": "Time",
      "outcome": "NOT_TESTED",
      "expected": "The stated clock policy is met; synchronization enabled alone does not prove accuracy.",
      "observed": null,
      "evidence_ids": [],
      "rationale": "Unexecuted template.",
      "severity": null,
      "confidence": null,
      "next_action": "Inspect host time and synchronization configuration; distinguish state from measured accuracy."
    },
    "TIM-02": {
      "domain": "Time",
      "outcome": "NOT_TESTED",
      "expected": "The responsible layer and returned timezone implement the established time policy.",
      "observed": null,
      "evidence_ids": [],
      "rationale": "Unexecuted template.",
      "severity": null,
      "confidence": null,
      "next_action": "Compare host timezone, saved profile timezone, launch override and live Intl/Date output."
    },
    "TIM-03": {
      "domain": "Time",
      "outcome": "NOT_TESTED",
      "expected": "Offsets are explainable under the named zone and timestamp, including fractional-hour zones.",
      "observed": null,
      "evidence_ids": [],
      "rationale": "Unexecuted template.",
      "severity": null,
      "confidence": null,
      "next_action": "Check timezone name and signed offset for the same instant; account for seasonal rules."
    },
    "PRF-01": {
      "domain": "Profile and launch",
      "outcome": "NOT_TESTED",
      "expected": "Work and test state boundaries match the declared purpose.",
      "observed": null,
      "evidence_ids": [],
      "rationale": "Unexecuted template.",
      "severity": null,
      "confidence": null,
      "next_action": "Confirm the selected data directory/profile persistence policy."
    },
    "PRF-02": {
      "domain": "Profile and launch",
      "outcome": "NOT_TESTED",
      "expected": "Each material override has an identified source; unexplained conflicts are recorded.",
      "observed": null,
      "evidence_ids": [],
      "rationale": "Unexecuted template.",
      "severity": null,
      "confidence": null,
      "next_action": "Inspect relevant OS, manager, policy, extension and launch overrides."
    },
    "PRF-03": {
      "domain": "Profile and launch",
      "outcome": "NOT_TESTED",
      "expected": "Current observations implement the intended saved state or a documented exception.",
      "observed": null,
      "evidence_ids": [],
      "rationale": "Unexecuted template.",
      "severity": null,
      "confidence": null,
      "next_action": "Compare saved selections with active process and page readings."
    },
    "NET-01": {
      "domain": "Network",
      "outcome": "NOT_TESTED",
      "expected": "The configured mechanism is supported by the actual browser implementation.",
      "observed": null,
      "evidence_ids": [],
      "rationale": "Unexecuted template.",
      "severity": null,
      "confidence": null,
      "next_action": "Record proxy type, redacted endpoint, configuration layer and authentication mechanism."
    },
    "NET-02": {
      "domain": "Network",
      "outcome": "NOT_TESTED",
      "expected": "The tested request follows the intended route; destination, time and IP family are recorded.",
      "observed": null,
      "evidence_ids": [],
      "rationale": "Unexecuted template.",
      "severity": null,
      "confidence": null,
      "next_action": "Observe an approved fresh exit-IP request from the target browser context."
    },
    "NET-03": {
      "domain": "Network",
      "outcome": "NOT_TESTED",
      "expected": "Effective routing rules match the network policy and explain exceptions.",
      "observed": null,
      "evidence_ids": [],
      "rationale": "Unexecuted template.",
      "severity": null,
      "confidence": null,
      "next_action": "Inspect relevant VPN/tunnel, PAC, bypass and split-routing configuration."
    },
    "NET-04": {
      "domain": "Network",
      "outcome": "NOT_TESTED",
      "expected": "Observed name resolution follows the policy within the documented test scope.",
      "observed": null,
      "evidence_ids": [],
      "rationale": "Unexecuted template.",
      "severity": null,
      "confidence": null,
      "next_action": "Assess DNS configuration and, when approved, resolution behavior on the tested route."
    },
    "NET-05": {
      "domain": "Network",
      "outcome": "NOT_TESTED",
      "expected": "Each applicable address family follows the route policy or has an explained unavailable state.",
      "observed": null,
      "evidence_ids": [],
      "rationale": "Unexecuted template.",
      "severity": null,
      "confidence": null,
      "next_action": "Inspect and separately test relevant IPv4 and IPv6 behavior."
    },
    "NET-06": {
      "domain": "Network",
      "outcome": "NOT_TESTED",
      "expected": "Approved tests support both the stated exposure policy and required real-time functions.",
      "observed": null,
      "evidence_ids": [],
      "rationale": "Unexecuted template.",
      "severity": null,
      "confidence": null,
      "next_action": "Inspect WebRTC/UDP policy and test required behavior when authorized."
    },
    "NET-07": {
      "domain": "Network",
      "outcome": "NOT_TESTED",
      "expected": "Failure behavior matches the declared policy, including fail-closed when required.",
      "observed": null,
      "evidence_ids": [],
      "rationale": "Unexecuted template.",
      "severity": null,
      "confidence": null,
      "next_action": "Test loss of proxy connectivity in an explicitly approved disposable signed-out context."
    },
    "NET-08": {
      "domain": "Network",
      "outcome": "NOT_TESTED",